id,title,douban_link,rating,year,image,video_url,summary,country,language,episode_duration,episode_count,director,scriptwriter,cast,official_website,also_known_as,genre
89,诛仙 第二季,https://movie.douban.com/subject/36219087/,8.7,2024,https://img1.doubanio.com/view/photo/s_ratio_poster/public/p2906005988.jpg,['https://www.douban.com/link2/?url=https%3A%2F%2Fv.qq.com%2Fx%2Fcover%2Fmzc00200faybjea%2Fq0048xcc1np.html%3Fptag%3Dnewdouban.cartoon&amp;subtype=1&amp;type=online-video'],正魔大战已过去十年，张小凡化身鬼厉，在魔教内斗中征伐四方。此时死亡沼泽异宝出世，引得各方势力争夺，鬼厉与陆雪琪重逢，两人陷入了更深的爱恨纠葛。后鬼厉因下属失踪一事追查至焚香谷，意外救出九尾天狐小白，获得古巫族线索，最终鬼厉在历经九死一生后，终求得掌握招魂奇术的大巫师答应前往救治碧瑶，十年夙愿，究竟结果如何……,中国大陆,汉语普通话,20分钟,26.0,"['黄汉均', '赵众']","['张琴', '林惊雷']","['边江', '段艺璇', '白雪岑', '王婧儿', '戈凡', '陈张太康']",,诛仙2 / Jade Dynasty,"['动作', '动画', '奇幻', '武侠', '古装']"
90,一人之下·锈铁重现,https://movie.douban.com/subject/36645798/,6.0,2024,https://img3.doubanio.com/view/photo/s_ratio_poster/public/p2904142083.jpg,['https://www.douban.com/link2/?url=https%3A%2F%2Fv.qq.com%2Fx%2Fcover%2Fmzc0020092vizln%2Fu0048wg1jah.html%3Fptag%3Dnewdouban.cartoon&amp;subtype=1&amp;type=online-video'],张楚岚和冯宝宝二人所在的哪都通公司派遣了一个特别任务——护送昔日的宝刀“蛭丸”到边境，完成和瀛国石川家一个几十年的约定。张楚岚和冯宝宝将面对陌生的队友、冬日恶劣的北地天气和虎视眈眈的夺刀强敌。一场“蛭丸”保卫战在林海雪原打响。,中国大陆,汉语普通话 / 日语,,,['陈烨'],"['竹林闲者', '陈烨', '左晓慧']","['吴俊全', '曹云图', '小连杀', '马正阳', '王肖兵', '刘明月', '叶知秋', '邓宥希', '柳真颜', '张闻天', '张欣', '张明亮', '刘莉', '藤新', '锦鲤', '刘北辰', '郝祥海', '刘海霞', '白楠', '任亚明', '李宇峰', '图特哈蒙', '黑特']",,一人之下番外·锈铁 / 一人之下剧场版：锈铁重现,"['动画', '奇幻']"
91,吸血鬼猎人D 吸血鬼ハンターD,https://movie.douban.com/subject/3055044/,8.5,1985,https://img9.doubanio.com/view/photo/s_ratio_poster/public/p987758494.jpg,['https://www.douban.com/link2/?url=https%3A%2F%2Fv.qq.com%2Fx%2Fcover%2Fmzc0020092vizln%2Fu0048wg1jah.html%3Fptag%3Dnewdouban.cartoon&amp;subtype=1&amp;type=online-video'],"西暦12090 年、舞台は辺境の町。一帯を支配する「貴族」リィ伯爵に血を吸われた少女ドリスは、吸血鬼ハンターの""D""を雇い入れた。ドリスを吸血鬼の一族へと迎え入れようとする伯爵、それに反発する彼の娘ラミーカ、強盗団の頭目であり不死を目論む麗銀星などの面々と、伯爵を狙う""D""との激闘が幕を開ける。",日本,日语,,,['芦田丰雄'],['平野靖士'],"['盐泽兼人', '永井一郎', '富泽美智江', '户田惠子', '加藤精三']",,Vampire Hunter D / OVA：吸血鬼ハンターD,"['动画', '恐怖', '奇幻']"
92,时光代理人 第一季,https://movie.douban.com/subject/35263440/,8.1,2021,https://img9.doubanio.com/view/photo/s_ratio_poster/public/p2669131265.jpg,['https://www.douban.com/link2/?url=https%3A%2F%2Fm.bilibili.com%2Fbangumi%2Fplay%2Fep400972%3Fbsource%3Ddoubanh5&amp;subtype=8&amp;type=online-video'],在繁华都市的某个角落，有一家叫做“时光照相馆”的小店还在照常营业。虽然门庭冷落，但它背后其实由两个具有特殊能力的男人——程小时和陆光经营着。为了完成顾客的委托，陆光和程小时组队配合使用超能力进入照片，然而事情的发展却没能按他们所想的那样……,中国大陆,汉语普通话,24分钟,11.0,['李豪凌'],['李豪凌'],"['杨天翔', '苏尚卿', '李诗萌', '赵熠彤', '郭浩然']",,Link Click,['动画']
93,数码宝贝02：最初的召唤 デジモンアドベンチャー02 THE BEGINNING,https://movie.douban.com/subject/35559564/,5.6,2023,https://img3.doubanio.com/view/photo/s_ratio_poster/public/p2906990602.jpg,"['https://www.douban.com/link2/?url=https%3A%2F%2Fv.qq.com%2Fx%2Fcover%2Fmzc00200ulummmm.html%3Fptag%3Dnewdouban.movie&amp;subtype=1&amp;type=online-video', 'https://www.douban.com/link2/?url=http%3A%2F%2Fwww.mgtv.com%2Fb%2F632643%2F21531951.html%3Fcxid%3Dvb4rv4jhk&amp;subtype=7&amp;type=online-video', 'https://www.douban.com/link2/?url=https%3A%2F%2Fm.bilibili.com%2Fbangumi%2Fplay%2Fss47518%3Fbsource%3Ddoubanh5&amp;subtype=8&amp;type=online-video']",2012年2月，东京铁塔上空出现了巨大的数码蛋。就在本宫大辅（20岁）和V仔兽修行拉面技艺的时候，遇到了虽然拿着有裂纹的数码器，但身边没有搭档数码兽的迷之青年——自称“我没有数码兽，我的搭档数码兽被我杀了，我是世界上最初和数码兽建立搭档关系的人类。”,日本,日语,,,['田口智久'],['大和屋晓'],"['片山福十郎', '野田顺子', '亚瑟·朗斯贝里', '高桥直纯', '朝井彩加', '远近孝一', '山谷祥生', '浦和惠', '榎木淳弥', '松本美和', '市道真央', '德光由禾', '绪方惠美', '钉宫理惠']",,数码宝贝02 THE BEGINNING(台) / 数码暴龙02 THE BEGINNING(港) / Digimon Adventure New Movie 02 / Digimon Adventure 02: The Beginning / 数码宝贝大冒险02 新剧场版,"['动画', '冒险']"
94,在下坂本，有何贵干？ 坂本ですが？,https://movie.douban.com/subject/26708698/,8.4,2016,https://img1.doubanio.com/view/photo/s_ratio_poster/public/p2329821809.jpg,['https://www.douban.com/link2/?url=https%3A%2F%2Fm.bilibili.com%2Fbangumi%2Fplay%2Fep85829%3Fbsource%3Ddoubanh5&amp;subtype=8&amp;type=online-video'],县立学文高中一年级2班，那里有位刚一入学就得到全校注目的男子，他的名字叫坂本（绿川光 配音）。他戴着黑边框眼镜，个人特征是左眼下的泪痣。他不但相貌英俊，着装整齐，而且眼神凌厉，一举一动都华丽潇洒，帅气爆表，因此总能成为众人的焦点，受到女生们的疯狂追捧，但是也因此引起不少同龄男生的嫉妒，包括同班同学阿酱（杉田智和 配音），以及高二级学长8823（游佐浩二 配音）。对面男生们花样百出的陷害和报复，坂本总能帅气满分地完美解决这些麻烦，让男生们甘拜下风。本剧改编自日本漫画家佐野菜见原作的同名漫画。,日本,日语,24分钟,12.0,"['高松信司', '赤城博昭', '久保太郎', '村田尚树', '木宫茂', '牧野友映', '葛谷直行']","['佐野菜见', '高松信司']","['绿川光', '石田彰', '杉田智和', '武内健', '堀江由衣', '森久保祥太郎', '田村由香里', '中原麻衣', '生天目仁美', '植田佳奈', '高桥美佳子', '游佐浩二', '前野智昭', '铃木达央', '中田让治', '桧山修之', '矢部雅史', '稻田彻', '岩田光央']",,我叫坂本我最屌,"['喜剧', '动画']"
95,中二病也要谈恋爱！ 中二病でも恋がしたい！,https://movie.douban.com/subject/11226092/,8.3,2012,https://img1.doubanio.com/view/photo/s_ratio_poster/public/p2326431930.jpg,['https://www.douban.com/link2/?url=https%3A%2F%2Fm.bilibili.com%2Fbangumi%2Fplay%2Fep329002%3Fbsource%3Ddoubanh5&amp;subtype=8&amp;type=online-video'],顺利升入高中的少年富樫勇太（福山润 配音）在初中时代曾是暗黑系的中二病患者，当年他自称黑炎之主人，自我感觉良好地度过了无厘头的中学生活。但是此刻他“痛改前非”，将这段经历看作不堪回首的耻辱过去，为此甚至不惜报考一个离家很远没有人认识自己的高中。在新的学校，勇太如愿以偿结 交了一色诚（保志总一朗 配音）、丹生谷森夏（赤崎千夏 配音）以及学姐五月七日茴香（浅仓幸美 配音）这样稍显正常的朋友，也准备和心仪的女孩大谈一场浪漫恋爱。但是令他备为挠头的是，楼上新搬来的住户兼同班同学小鸟游六花（内田真礼 配音）却是一个中二病的深度患者。小女孩每天唧唧歪歪，怪力乱神。好不容易摆脱初中阴影的勇太，高中恋爱之梦日渐飘渺……,日本,日语,24分钟,13.0,"['石原立也', '木上益治', '武本康弘', '石立太一', '北之原孝将', '内海纮子', '坂本一也', '河浪荣作']","['花田十辉', '虎虎']","['福山润', '内田真礼', '赤崎千夏', '浅仓杏美', '上坂堇', '天野由梨', '福原香织', '设乐麻美', '保志总一朗']",,中二病也想谈恋爱！(港) / Chuunibyou Demo Koi ga Shitai!,"['喜剧', '动画']"
96,某科学的超电磁炮 とある科学の超電磁砲,https://movie.douban.com/subject/4067827/,8.6,2009,https://img9.doubanio.com/view/photo/s_ratio_poster/public/p2199762985.jpg,['https://www.douban.com/link2/?url=https%3A%2F%2Fm.bilibili.com%2Fbangumi%2Fplay%2Fep84340%3Fbsource%3Ddoubanh5&amp;subtype=8&amp;type=online-video'],本剧以镰池和马所著的轻小说《魔法禁书目录》中的人气角色御坂美琴为主角的外传漫画《科学超电磁炮》改编。故事发生在面积占据东京都西部的三分之一，居住着230万名人口，其中八成人口是学生的巨大都市“学园都市”。学园都市和外部隔离，研究最尖端科技。所有学生都接受超能力开发，并大都借由药物、催眠术与通电刺激等方式取得超能力。有各种类型不同能力，以范围和威力分为无能力者（Level 0）、低能力者（Level 1）、异能力者（Level 2）、强能力者（Level 3）、大能力者（Level 4）和超能力者（Level5）。故事从学园都市最强的电击公主“超电磁炮”御坂美琴，某天认识了和黑子一样担任风纪委员的初春饰利开始......,日本,日语,24 分钟,24.0,"['长井龙雪', '笠井贤一', '山内重保', '湖山祯崇', '则座诚', '橘秀树', '神保昌登', '高岛大辅', '八谷贤一', '神谷智大', '马引圭', '中津环', '川畑乔']","['水上清资', '大野木宽', '伊藤美智子', '国泽真理子', '浅川美也', '砂山藏澄', '天河信彦', '冬川基', '镰池和马']","['佐藤利奈', '新井里美', '丰崎爱生', '伊藤加奈惠', '寿美菜子', '户松遥', '南条爱乃', '植田佳奈', '仲野裕', '生天目仁美', '远藤绫', '甲斐田裕子', '阿部敦', '古山贵实子', '井口裕香', '能登麻美子', '福圆美里', '柚木凉香', '田中敦子', '大原沙耶香', '佐藤聪美', '花泽香菜']",,科学超电磁炮 / To Aru Kagaku no Railgun / A Certain Scientific Railgun,"['科幻', '动画']"
97,小林家的龙女仆 小林さんちのメイドラゴン,https://movie.douban.com/subject/26899726/,8.9,2017,https://img1.doubanio.com/view/photo/s_ratio_poster/public/p2436339010.jpg,['https://www.douban.com/link2/?url=https%3A%2F%2Fm.bilibili.com%2Fbangumi%2Fplay%2Fep98603%3Fbsource%3Ddoubanh5&amp;subtype=8&amp;type=online-video'],小林（田村睦心 配音）是一位非常平凡的程序员，在一次偶然之中救了一条名叫托尔（桑原由气 配音）的龙，为了报答小林的救命之恩，托尔化身成为了女仆的样子来到了小林家中，就这样，小林和龙女仆的同居生活就此拉开序幕。古灵精怪我行我素的康娜卡姆依（长绳麻理亚 配音）、对人类有着非常深的成见，但似乎不太聪明的样子的艾露玛（高田忧希 配音）、心思细腻温柔又稳重的大姐姐露科亚（高桥未奈美 配音）、痛恨着人类，但又无法自持的被人类所发明出来的游戏所吸引的法夫纳（小野大辅 配音），自托尔之后，小林的身边接二连三的出现了这些性格迥异的龙族们。,日本,日语,24分钟,13.0,"['武本康弘', '山田尚子', '山村卓也', '藤田春香', '北之原孝将', '小川太一', '木上益治']","['山田由香', '志茂文彦', '西川昌志', '武本康弘', '酷教信者']","['田村睦心', '桑原由气', '长绳麻理亚', '高田忧希', '高桥未奈美', '加藤英美里', '后藤邑子', '石原夏织', '小野大辅', '中村悠一']",,小林家的妹抖龙 / Kobayashi-san Chi no Maid Dragon,"['喜剧', '动画']"
98,中国古诗词动漫,https://movie.douban.com/subject/30304531/,9.1,2017,https://img3.doubanio.com/view/photo/s_ratio_poster/public/p2787129887.jpg,['https://www.douban.com/link2/?url=https%3A%2F%2Fm.bilibili.com%2Fbangumi%2Fplay%2Fep115520%3Fbsource%3Ddoubanh5&amp;subtype=8&amp;type=online-video'],“中国唱诗班”系列动画由中共嘉定区委宣传部投资出品，已列为嘉定800年重点项目之一。这批动画完全由中国青年团队独立原创手绘，在故事、场景、人物、服饰方面都根据历史文献，进行反复考证修改，以期能在细节上最大程度还原当时历史情景，使影片不仅成为一个有故事的动画 作品，更成为一个可以管窥一个时代风貌的绘卷。,中国大陆,汉语普通话,10分钟,,"['彭擎政', '林旭坚']",['李夏恩'],,,中国唱诗班,['动画']
99,你看起来好像很好吃 おまえうまそうだな,https://movie.douban.com/subject/4848115/,8.9,2010,https://img3.doubanio.com/view/photo/s_ratio_poster/public/p709670262.jpg,['https://www.douban.com/link2/?url=https%3A%2F%2Fm.bilibili.com%2Fbangumi%2Fplay%2Fep115520%3Fbsource%3Ddoubanh5&amp;subtype=8&amp;type=online-video'],哈特（山口胜平 饰）是一只被草食性恐龙养大的霸王龙。其实，早在它破壳而出时，草食性恐龙的首领就曾命令哈特的母亲（原田知世 饰）抛弃它，但母亲却最终还是偷偷把它养大。随着年龄的增长，每天只吃野果的哈特每天饥饿难耐，最终还是抵不住本能的驱使，开始了自己食肉的残暴生涯。然而，由于母亲的影响，在哈特的内心深处，始终涌动着一颗善良的心灵。一天，偶尔遇到一只破壳而出的食草恐龙宝宝，哈特阴差阳错的被恐龙宝宝误认为是“爸爸”，而且为小恐龙取名为“很美味”，自此开始了又一段奇异的恐龙父子情。然而，伴随着生存环境的恶化，恐龙们的生存遭受着前所未有的破坏，哈特和它的亲人最终能否经得起考验……本篇由日本知名漫画家宫西达也的同名漫画改编，本书曾获剑渊绘本乡绘本奖大奖。,日本,日语,,,['藤森雅也'],"['村上修', '神野博明', '宫西达也']","['山口胜平', '爱河里花子', '加藤清史郎', '原田知世', '川岛得爱', '折笠富美子', '桐本拓哉', '别所哲也', '矢田稔', '川村万梨阿', '高乃丽', '小室正幸', '江川央生', '志村知幸', '胜沼纪义', '井田国男', '宫西达也', '宫西美奈子']",,你看起来很好吃(台) / 你看上去好像很好吃 / 你好像很美味啊 / 我的暴龙老爸 / 고녀석 맛나겠다 / Omae Umasou da na / You Are Umasou / Heart and Yummie,"['剧情', '动画', '儿童']"
